{
  "groups": [
    {
      "id": "G-EXEC",
      "name": "Hospital Executive",
      "business_unit": "Corporate",
      "tier": 0,
      "headcount": 9,
      "sentiment": "Advocate",
      "influence": 5,
      "interest": 4,
      "summary": "Sponsors the programme and expects same-day warning if a department pushes back.",
      "evidence": [
        "E1",
        "E11"
      ]
    },
    {
      "id": "G-CMB",
      "name": "Chairman Medical Board",
      "business_unit": "Clinical",
      "tier": 1,
      "headcount": 8,
      "sentiment": "Neutral",
      "influence": 5,
      "interest": 4,
      "summary": "Sets clinical standards. Consultants take complaints here.",
      "evidence": [
        "E1",
        "E10"
      ],
      "open_questions": [
        "What would the Medical Board need to see before endorsing the order sets?"
      ]
    },
    {
      "id": "G-MED",
      "name": "Department of Medicine",
      "business_unit": "Clinical",
      "tier": 2,
      "headcount": 60,
      "sentiment": "Unknown",
      "influence": 4,
      "interest": 5,
      "summary": "Senior consultants and heads of department in internal medicine.",
      "evidence": [
        "E1",
        "E4"
      ]
    },
    {
      "id": "G-SURG",
      "name": "Department of Surgery",
      "business_unit": "Clinical",
      "tier": 2,
      "headcount": 55,
      "sentiment": "Skeptic",
      "influence": 4,
      "interest": 4,
      "summary": "Surgeons. Rumoured to want paper drug charts in theatre.",
      "evidence": [
        "E2",
        "E7"
      ],
      "confidence": "Low",
      "open_questions": [
        "What does Surgery actually need in theatre that the order sets do not give?"
      ]
    },
    {
      "id": "G-ED",
      "name": "Emergency Department",
      "business_unit": "Clinical",
      "tier": 2,
      "headcount": 70,
      "sentiment": "Unknown",
      "influence": 3,
      "interest": 5,
      "summary": "Fast turnover and heavy handovers.",
      "evidence": [
        "E1"
      ]
    },
    {
      "id": "G-RES",
      "name": "Resident doctors and medical officers",
      "business_unit": "Clinical",
      "tier": 4,
      "headcount": 320,
      "sentiment": "Neutral",
      "influence": 2,
      "interest": 5,
      "summary": "Rotate every few months. Adopt anything that saves night-time typing, if the consultants allow it.",
      "evidence": [
        "E4"
      ]
    },
    {
      "id": "G-NURD",
      "name": "Nursing Directorate",
      "business_unit": "Nursing",
      "tier": 2,
      "headcount": 20,
      "sentiment": "Advocate",
      "influence": 4,
      "interest": 5,
      "summary": "Backs the programme if downtime procedures are written with the wards.",
      "evidence": [
        "E1",
        "E6"
      ]
    },
    {
      "id": "G-WARD",
      "name": "Ward nurse managers",
      "business_unit": "Nursing",
      "tier": 3,
      "headcount": 70,
      "sentiment": "Neutral",
      "influence": 4,
      "interest": 5,
      "summary": "Run the wards: roster, bed state and who gets the tablets.",
      "evidence": [
        "E5",
        "E15"
      ]
    },
    {
      "id": "G-NURS",
      "name": "Staff nurses",
      "business_unit": "Nursing",
      "tier": 4,
      "headcount": 1100,
      "sentiment": "Unknown",
      "influence": 3,
      "interest": 5,
      "summary": "Ring their ward manager, not the IT helpdesk.",
      "evidence": [
        "E16"
      ]
    },
    {
      "id": "G-PHARM",
      "name": "Pharmacy",
      "business_unit": "Pharmacy",
      "tier": 3,
      "headcount": 90,
      "sentiment": "Advocate",
      "influence": 3,
      "interest": 5,
      "summary": "Wants e-prescribing. Worries juniors will click through alerts.",
      "evidence": [
        "E1",
        "E8"
      ]
    },
    {
      "id": "G-ALLIED",
      "name": "Allied Health",
      "business_unit": "Allied",
      "tier": 3,
      "headcount": 150,
      "sentiment": "Unknown",
      "influence": 2,
      "interest": 4,
      "summary": "Physiotherapy, dietetics and others.",
      "evidence": [
        "E1"
      ]
    },
    {
      "id": "G-PSQ",
      "name": "Patient Safety and Quality",
      "business_unit": "Quality",
      "tier": 2,
      "headcount": 22,
      "sentiment": "Neutral",
      "influence": 5,
      "interest": 4,
      "summary": "Signs off every order set. Its review queue is the slowest part of the build.",
      "evidence": [
        "E1",
        "E14"
      ]
    },
    {
      "id": "G-CI",
      "name": "Clinical Informatics",
      "business_unit": "Technology",
      "tier": 2,
      "headcount": 30,
      "sentiment": "Advocate",
      "influence": 3,
      "interest": 5,
      "summary": "Designs and configures the record, tests ideas with ward managers first.",
      "evidence": [
        "E1",
        "E2",
        "E3"
      ]
    },
    {
      "id": "G-PSF",
      "name": "Patient Services and Finance",
      "business_unit": "Corporate",
      "tier": 2,
      "headcount": 140,
      "sentiment": "Neutral",
      "influence": 3,
      "interest": 4,
      "summary": "Billing and patient registration.",
      "evidence": [
        "E1",
        "E17"
      ]
    },
    {
      "id": "G-HR",
      "name": "HR",
      "business_unit": "Corporate",
      "tier": 2,
      "headcount": 40,
      "sentiment": "Unknown",
      "influence": 3,
      "interest": 3,
      "summary": "Owns role changes and consultation with the nursing union.",
      "evidence": [
        "E1"
      ]
    },
    {
      "id": "G-PMO",
      "name": "Programme Office",
      "business_unit": "Corporate",
      "tier": 2,
      "headcount": 10,
      "sentiment": "Advocate",
      "influence": 4,
      "interest": 5,
      "summary": "Runs the programme and reports monthly to cluster headquarters.",
      "evidence": [
        "E1",
        "E11",
        "E12",
        "E13"
      ]
    },
    {
      "id": "G-MOH",
      "name": "Ministry of Health (funder and regulator)",
      "business_unit": "External",
      "tier": 5,
      "headcount": 0,
      "sentiment": "Neutral",
      "influence": 5,
      "interest": 2,
      "summary": "Reads the monthly programme report.",
      "evidence": [
        "E12"
      ]
    },
    {
      "id": "G-HQ",
      "name": "Health cluster headquarters",
      "business_unit": "External",
      "tier": 5,
      "headcount": 0,
      "sentiment": "Neutral",
      "influence": 4,
      "interest": 3,
      "summary": "Releases funding in tranches.",
      "evidence": [
        "E12"
      ]
    },
    {
      "id": "G-NU",
      "name": "Nurses' union branch",
      "business_unit": "External",
      "tier": 5,
      "headcount": 0,
      "sentiment": "Unknown",
      "influence": 3,
      "interest": 4,
      "summary": "Has asked to see the downtime plan.",
      "evidence": [
        "E13"
      ]
    },
    {
      "id": "G-VEND",
      "name": "EMR vendor",
      "business_unit": "External",
      "tier": 5,
      "headcount": 0,
      "sentiment": "Advocate",
      "influence": 3,
      "interest": 5,
      "summary": "Delivers the record platform.",
      "evidence": [
        "E3"
      ]
    }
  ],
  "individuals": [
    {
      "id": "P-CEO",
      "group": "G-EXEC",
      "name": "Dr Amanda Lim",
      "title": "Chief Executive",
      "sentiment": "Advocate",
      "influence": 5,
      "evidence": [
        "E11"
      ]
    },
    {
      "id": "P-CMB",
      "group": "G-CMB",
      "name": "Prof Edmund Chua",
      "title": "Chairman, Medical Board",
      "sentiment": "Neutral",
      "influence": 5,
      "evidence": [
        "E10"
      ]
    },
    {
      "id": "P-SURG",
      "group": "G-SURG",
      "name": "Prof Kelvin Ho",
      "title": "Head of Surgery",
      "sentiment": "Skeptic",
      "influence": 5,
      "evidence": [
        "E2",
        "E7"
      ],
      "confidence": "Low"
    },
    {
      "id": "P-DON",
      "group": "G-NURD",
      "name": "Doreen Wee",
      "title": "Director of Nursing",
      "sentiment": "Advocate",
      "influence": 4,
      "evidence": [
        "E5",
        "E6",
        "E15"
      ]
    },
    {
      "id": "P-WARD",
      "group": "G-WARD",
      "name": "Siti Rahmah",
      "title": "Senior ward manager, surgical wards",
      "sentiment": "Neutral",
      "influence": 4,
      "evidence": [
        "E15",
        "E16",
        "E17"
      ]
    },
    {
      "id": "P-PH",
      "group": "G-PHARM",
      "name": "Dr Joel Ng",
      "title": "Chief Pharmacist",
      "sentiment": "Advocate",
      "influence": 3,
      "evidence": [
        "E8",
        "E9",
        "E10"
      ]
    },
    {
      "id": "P-CI",
      "group": "G-CI",
      "name": "Dr Aisha Karim",
      "title": "Chief Clinical Informatics Officer",
      "sentiment": "Advocate",
      "influence": 4,
      "evidence": [
        "E2",
        "E3",
        "E4",
        "E9"
      ]
    },
    {
      "id": "P-PMO",
      "group": "G-PMO",
      "name": "Rohan Pillai",
      "title": "Programme Director",
      "sentiment": "Advocate",
      "influence": 4,
      "evidence": [
        "E11",
        "E12",
        "E13",
        "E14"
      ]
    }
  ],
  "relationships": [
    {
      "id": "F01",
      "from": "G-CMB",
      "to": "G-EXEC",
      "kind": "formal",
      "type": "reports_to",
      "strength": 3,
      "confidence": "High",
      "evidence": [
        "E1"
      ]
    },
    {
      "id": "F02",
      "from": "G-MED",
      "to": "G-EXEC",
      "kind": "formal",
      "type": "reports_to",
      "strength": 3,
      "confidence": "High",
      "evidence": [
        "E1"
      ]
    },
    {
      "id": "F03",
      "from": "G-SURG",
      "to": "G-EXEC",
      "kind": "formal",
      "type": "reports_to",
      "strength": 3,
      "confidence": "High",
      "evidence": [
        "E1"
      ]
    },
    {
      "id": "F04",
      "from": "G-ED",